{
  "schema_version": "1",
  "history_schema_version": "1",
  "history_storage_key": "cem.active-understanding.history.v1",
  "max_history_records": 100,
  "confidence_scale": ["low", "medium", "high"],
  "challenges": [
    {
      "id": "AU-1",
      "family": "EXPOSURE_VS_FAMILIARITY",
      "prediction_format": "DIRECTION",
      "learning_target": {
        "ro": "Expunerea și familiaritatea sunt variabile distincte; o expunere înregistrată actualizează familiaritatea în modelul de referință.",
        "en": "Exposure and familiarity are distinct variables; a registered exposure updates familiarity in the reference model."
      },
      "worked_example_refs": [
        "THEORY.05.REPETITION_FAMILIARITY_TRUTH",
        "VAR.EXPOSURE.COUNT",
        "VAR.FAMILIARITY.CLAIM"
      ],
      "prompt": {
        "ro": "În rularea de referință Repetiție, ce se întâmplă cu familiaritatea F după prima expunere?",
        "en": "In the Repetition reference run, what happens to familiarity F after the first exposure?"
      },
      "choices": [
        {"id": "INCREASE", "label": {"ro": "Crește", "en": "Increases"}},
        {"id": "DECREASE", "label": {"ro": "Scade", "en": "Decreases"}},
        {"id": "UNCHANGED", "label": {"ro": "Rămâne aproximativ neschimbată", "en": "Remains approximately unchanged"}}
      ],
      "correct_choice_id": "INCREASE",
      "canonical_target_refs": [
        "VAR.EXPOSURE.COUNT",
        "VAR.FAMILIARITY.CLAIM",
        "VAL.M0.001"
      ],
      "canonical_relation_refs": [
        "COMPDEP.EXPOSURE.FAMILIARITY",
        "LINK.EXPOSURE.FAMILIARITY"
      ],
      "explanation": {
        "ro": "Între pașii 0 și 1, F crește de la 0 la 0,35 în rularea canonică. Expunerea este evenimentul; familiaritatea este starea actualizată.",
        "en": "Between steps 0 and 1, F rises from 0 to 0.35 in the canonical run. Exposure is the event; familiarity is the updated state."
      },
      "epistemic_boundary": {
        "ro": "Familiaritatea nu este adevăr și nici forță a dovezii. Forma F′ = F + αf(1 − F) este o formă de referință, nu o ecuație psihologică calibrată populațional.",
        "en": "Familiarity is neither truth nor evidence strength. The form F′ = F + αf(1 − F) is a reference form, not a population-calibrated psychological equation."
      },
      "fixture": {
        "type": "RUN_DELTA",
        "artifact_path": "web/public/model/runs.json",
        "run_id": "repetition",
        "from_time": 0,
        "to_time": 1,
        "field": "familiarity",
        "expected_from": 0.0,
        "expected_to": 0.35
      }
    },
    {
      "id": "AU-2",
      "family": "BELIEF_VS_SHARING",
      "prediction_format": "DIRECT_TARGET",
      "learning_target": {
        "ro": "Convingerea B și calea de distribuire sunt distincte; indiciul de acuratețe acționează direct asupra salienței acurateții W, nu direct asupra lui B.",
        "en": "Belief B and the sharing pathway are distinct; the accuracy cue acts directly on accuracy salience W, not directly on B."
      },
      "worked_example_refs": [
        "THEORY.08.BELIEF_ACCURACY_ACTION",
        "VAR.BELIEF.CLAIM",
        "VAR.ACCURACY.SALIENCE",
        "VAR.ACTION.SHARE"
      ],
      "prompt": {
        "ro": "Ce obiect semantic este ținta directă a indiciului de acuratețe în graful de calcul canonic?",
        "en": "Which semantic object is the direct target of the accuracy cue in the canonical computational graph?"
      },
      "choices": [
        {"id": "ACCURACY_SALIENCE", "label": {"ro": "Saliența acurateții W", "en": "Accuracy salience W"}},
        {"id": "BELIEF", "label": {"ro": "Convingerea B", "en": "Belief B"}},
        {"id": "SHARE_ACTION", "label": {"ro": "Acțiunea Share", "en": "Share action"}}
      ],
      "correct_choice_id": "ACCURACY_SALIENCE",
      "canonical_target_refs": [
        "COMP.NODE.ACCURACY_CUE_INPUT",
        "VAR.ACCURACY.SALIENCE",
        "VAR.BELIEF.CLAIM",
        "VAR.ACTION.SHARE",
        "VAL.M0.N01"
      ],
      "canonical_relation_refs": [
        "COMPDEP.ACCURACY_CUE.ACCURACY_SALIENCE",
        "COMPDEP.ACCURACY_SALIENCE.SHARE_PROBABILITY",
        "LINK.ACCURACY.ACTION"
      ],
      "explanation": {
        "ro": "Dependența canonică duce de la intrarea Accuracy cue la W. W intră apoi în utilitatea de distribuire; B rămâne o stare distinctă și nu este ținta directă a cue-ului.",
        "en": "The canonical dependency runs from the Accuracy cue input to W. W then enters sharing utility; B remains a distinct state and is not the cue's direct target."
      },
      "epistemic_boundary": {
        "ro": "Faptul că există o dependență executabilă nu transformă automat acea legătură într-o estimare cauzală calibrată. M0 păstrează explicit separarea dintre convingere și acțiune.",
        "en": "An executable dependency does not automatically become a calibrated causal estimate. M0 explicitly preserves the distinction between belief and action."
      },
      "fixture": {
        "type": "RELATION_TARGET",
        "relation_id": "COMPDEP.ACCURACY_CUE.ACCURACY_SALIENCE",
        "expected_target_id": "VAR.ACCURACY.SALIENCE"
      }
    },
    {
      "id": "AU-3",
      "family": "COMPUTATION_VS_CAUSAL_EVIDENCE",
      "prediction_format": "RELATION_LAYER",
      "learning_target": {
        "ro": "O dependență de calcul și o relație din registrul de dovezi sunt straturi semantice diferite, chiar când leagă aceleași variabile.",
        "en": "A computational dependency and an evidence-registry relation are different semantic layers even when they connect the same variables."
      },
      "worked_example_refs": [
        "THEORY.05.REPETITION_FAMILIARITY_TRUTH",
        "VAR.EXPOSURE.COUNT",
        "VAR.FAMILIARITY.CLAIM"
      ],
      "prompt": {
        "ro": "În ce strat semantic se află relația COMPDEP.EXPOSURE.FAMILIARITY?",
        "en": "Which semantic layer contains COMPDEP.EXPOSURE.FAMILIARITY?"
      },
      "choices": [
        {"id": "COMPUTATIONAL_DEPENDENCY", "label": {"ro": "Dependență de calcul", "en": "Computational dependency"}},
        {"id": "REGISTERED_EVIDENCE_RELATION", "label": {"ro": "Relație în registrul de dovezi", "en": "Evidence-registry relation"}},
        {"id": "DOCUMENTATION_RELATION", "label": {"ro": "Relație de documentație", "en": "Documentation relation"}}
      ],
      "correct_choice_id": "COMPUTATIONAL_DEPENDENCY",
      "canonical_target_refs": [
        "VAR.EXPOSURE.COUNT",
        "VAR.FAMILIARITY.CLAIM"
      ],
      "canonical_relation_refs": [
        "COMPDEP.EXPOSURE.FAMILIARITY",
        "LINK.EXPOSURE.FAMILIARITY"
      ],
      "explanation": {
        "ro": "COMPDEP.EXPOSURE.FAMILIARITY descrie dependența executabilă. LINK.EXPOSURE.FAMILIARITY este o relație separată din registrul de dovezi și poartă statusurile și referințele empirice.",
        "en": "COMPDEP.EXPOSURE.FAMILIARITY describes the executable dependency. LINK.EXPOSURE.FAMILIARITY is a separate evidence-registry relation carrying empirical statuses and references."
      },
      "epistemic_boundary": {
        "ro": "Executabilitatea arată cum calculează software-ul. Nu demonstrează singură că aceeași relație este cauzală în populații reale.",
        "en": "Executability shows how the software computes. By itself it does not establish that the same relationship is causal in real populations."
      },
      "fixture": {
        "type": "RELATION_LAYER",
        "relation_id": "COMPDEP.EXPOSURE.FAMILIARITY",
        "expected_layer": "COMPUTATIONAL_DEPENDENCY",
        "contrast_relation_id": "LINK.EXPOSURE.FAMILIARITY",
        "contrast_layer": "REGISTERED_EVIDENCE_RELATION"
      }
    }
  ]
}
